{
  "schema_version": "1.0",
  "graph_id": "calcom-booking-llm-only",
  "variant": "llm-only",
  "repository": {
    "url": "https://github.com/calcom/cal.com.git",
    "resolved_url": "https://github.com/calcom/cal.diy",
    "commit": "54343aa685ae8f33159d2f485ec4a57bad5c574a"
  },
  "scope": {
    "name": "Booking subsystem: public booking, availability, creation, rescheduling, cancellation and selected host management",
    "coverage": "Scoped source-based baseline, not an exhaustive graph of the repository or every booking branch.",
    "entrypoints": [
      "/[user]/[type]",
      "/booking/[uid]",
      "/reschedule/[uid]",
      "/bookings/[status]",
      "/api/book/event",
      "/api/book/recurring-event",
      "/api/cancel",
      "viewer.public.event",
      "viewer.slots.getSchedule",
      "viewer.slots.reserveSlot",
      "viewer.slots.removeSelectedSlotMark",
      "viewer.bookings.get",
      "viewer.bookings.getBookingDetails",
      "viewer.bookings.confirm"
    ],
    "excluded": [
      "API v1/v2 server internals and platform atoms",
      "Team/organization, routing-form, hashed-link and embed entrypoint variants",
      "Payment flows, anti-abuse internals, dry-run and decoy success branches",
      "Provider, task-queue, workflow, authentication and email-verification internals",
      "Calendar-overlay UI, host calendar presentation, editing location, adding guests and request-reschedule actions",
      "Exhaustive seated/round-robin/recurring conditional subgraphs and every source helper"
    ],
    "grouping_policy": "Component membership is explicit and may overlap for shared router/schema/helper files. Evidence spans disambiguate shared files. Only inspected members are listed; membership does not claim exhaustive ownership.",
    "edge_policy": "Directed relationships between grouped components. calls may cross helpers within a component; reads includes documented in-memory model reads. Conditional behavior is stated in descriptions. No transitive relationship is silently treated as a direct call."
  },
  "nodes": [
    {
      "id": "public-page",
      "label": "Public booking page",
      "type": "page",
      "group": "Public booking",
      "summary": "The /[user]/[type] route loads public event data and existing booking context, then renders the booking view. This node includes its route adapter and server-side loader.",
      "files": [
        "apps/web/app/(booking-page-wrapper)/[user]/[type]/page.tsx",
        "apps/web/modules/users/views/users-type-public-view.tsx",
        "apps/web/server/lib/[user]/[type]/getServerSideProps.ts"
      ],
      "evidence": [
        {
          "path": "apps/web/app/(booking-page-wrapper)/[user]/[type]/page.tsx",
          "start_line": 15,
          "end_line": 33,
          "excerpt": "const getData: (ctx: ReturnType<typeof buildLegacyCtx>) => Promise<LegacyPageProps> =\n  withAppDirSsr<LegacyPageProps>(getServerSideProps);\n\nconst ServerPage = async ({ params, searchParams }: PageProps): Promise<JSX.Element> => {\n  const legacyCtx = buildLegacyCtx(await headers(), await cookies(), await params, await searchParams);\n  const props = await getData(legacyCtx);\n\n  const locale = props.eventData?.interfaceLanguage;\n  if (locale) {\n    const ns = \"common\";\n    const translations = await loadTranslations(locale, ns);\n    return (\n      <CustomI18nProvider translations={translations} locale={locale} ns={ns}>\n        <LegacyPage {...props} />\n      </CustomI18nProvider>\n    );\n  }\n\n  return <LegacyPage {...props} />;"
        },
        {
          "path": "apps/web/modules/users/views/users-type-public-view.tsx",
          "start_line": 27,
          "end_line": 40,
          "excerpt": "function Type({ slug, user, isEmbed, booking, isBrandingHidden, eventData, orgBannerUrl }: PageProps) {\n  const searchParams = useSearchParams();\n\n  return (\n    <BookingPageErrorBoundary>\n      <main className={getBookerWrapperClasses({ isEmbed: !!isEmbed })}>\n        <Booker\n          username={user}\n          eventSlug={slug}\n          bookingData={booking}\n          hideBranding={isBrandingHidden}\n          eventData={eventData}\n          entity={{ ...eventData.entity, eventTypeId: eventData?.id }}\n          durationConfig={eventData.metadata?.multipleDuration}"
        },
        {
          "path": "apps/web/server/lib/[user]/[type]/getServerSideProps.ts",
          "start_line": 149,
          "end_line": 160,
          "excerpt": "  // We use this to both prefetch the query on the server,\n  // as well as to check if the event exist, so we c an show a 404 otherwise.\n\n  const eventData = await EventRepository.getPublicEvent(\n    {\n      username: usernames.join(\"+\"),\n      eventSlug: slug,\n      org,\n      fromRedirectOfNonOrgLink: context.query.orgRedirection === \"true\",\n    },\n    session?.user?.id\n  );"
        }
      ]
    },
    {
      "id": "public-event",
      "label": "Public event lookup",
      "type": "service",
      "group": "Public booking",
      "summary": "Resolves a public event by username and slug and shapes event configuration for the booker; reused by SSR and the public tRPC query.",
      "files": [
        "packages/features/eventtypes/lib/getPublicEvent.ts",
        "packages/features/eventtypes/repositories/EventRepository.ts"
      ],
      "evidence": [
        {
          "path": "packages/features/eventtypes/repositories/EventRepository.ts",
          "start_line": 12,
          "end_line": 24,
          "excerpt": "export class EventRepository {\n  static async getPublicEvent(input: GetPublicEventInput, userId?: number) {\n    const event = await getPublicEvent(\n      input.username,\n      input.eventSlug,\n      input.isTeamEvent,\n      input.org,\n      prisma,\n      input.fromRedirectOfNonOrgLink,\n      userId\n    );\n    return event;\n  }"
        },
        {
          "path": "packages/features/eventtypes/lib/getPublicEvent.ts",
          "start_line": 437,
          "end_line": 444,
          "excerpt": "  // In case it's not a group event, it's either a single user or a team, and we query that data.\n  let event = await prisma.eventType.findFirst({\n    where: {\n      slug: eventSlug,\n      ...usersOrTeamQuery,\n    },\n    select: getPublicEventSelect(fetchAllUsers),\n  });"
        }
      ]
    },
    {
      "id": "booker",
      "label": "Booker composition",
      "type": "ui_component",
      "group": "Public booking",
      "summary": "Coordinates event data, availability, reservation and booking hooks and renders event details, date/time selection and the attendee form.",
      "files": [
        "apps/web/modules/bookings/components/Booker.tsx",
        "apps/web/modules/bookings/components/BookerWebWrapper.tsx"
      ],
      "evidence": [
        {
          "path": "apps/web/modules/bookings/components/BookerWebWrapper.tsx",
          "start_line": 131,
          "end_line": 159,
          "excerpt": "  const slots = useSlots(event?.data ? { id: event.data.id, length: event.data.length } : null);\n\n  const isEmbed = useIsEmbed();\n\n  /**\n   * Prioritize dateSchedule load\n   * Component will render but use data already fetched from here, and no duplicate requests will be made\n   * */\n  const schedule = useScheduleForEvent({\n    eventId: props.entity.eventTypeId ?? event.data?.id,\n    username: props.username,\n    dayCount,\n    eventSlug: props.eventSlug,\n    month: props.month,\n    duration: props.duration,\n    selectedDate,\n    teamMemberEmail: props.teamMemberEmail,\n    fromRedirectOfNonOrgLink: props.entity.fromRedirectOfNonOrgLink,\n    isTeamEvent: props.isTeamEvent ?? !!event.data?.team,\n    useApiV2: props.useApiV2,\n    bookerLayout,\n    ...(props.entity.orgSlug ? { orgSlug: props.entity.orgSlug } : {}),\n  });\n  const bookings = useBookings({\n    event,\n    hashedLink: props.hashedLink,\n    bookingForm: bookerForm.bookingForm,\n    metadata: metadata ?? {},\n    teamMemberEmail: props.teamMemberEmail,"
        },
        {
          "path": "apps/web/modules/bookings/components/Booker.tsx",
          "start_line": 248,
          "end_line": 258,
          "excerpt": "    renderConfirmNotVerifyEmailButtonCond ? handleBookEvent(timeSlot) : handleVerifyEmail();\n\n  const EventBooker = useMemo(() => {\n    if (bookerState !== \"booking\") {\n      return null;\n    }\n\n    return (\n      <BookEventForm\n        key={key}\n        timeslot={selectedTimeslot}"
        }
      ]
    },
    {
      "id": "event-summary",
      "label": "Event summary",
      "type": "ui_component",
      "group": "Public booking",
      "summary": "Displays event metadata such as title, duration, organizer, location and price within the booker.",
      "files": [
        "apps/web/modules/bookings/components/EventMeta.tsx"
      ],
      "evidence": [
        {
          "path": "apps/web/modules/bookings/components/EventMeta.tsx",
          "start_line": 46,
          "end_line": 61,
          "excerpt": "export const EventMeta = ({\n  event,\n  isPending,\n  isPlatform = true,\n  isPrivateLink,\n  classNames,\n  locale,\n  timeZones,\n  children,\n  selectedTimeslot,\n  roundRobinHideOrgAndTeam,\n  hideOrgTeamAvatar,\n  hideEventTypeDetails = false,\n}: {\n  event?: Pick<\n    BookerEvent,"
        }
      ]
    },
    {
      "id": "date-slots",
      "label": "Date and time selection",
      "type": "ui_component",
      "group": "Public booking",
      "summary": "Presents dates and available time slots and handles selecting or submitting a slot.",
      "files": [
        "apps/web/modules/bookings/components/AvailableTimeSlots.tsx",
        "apps/web/modules/bookings/components/DatePicker.tsx"
      ],
      "evidence": [
        {
          "path": "apps/web/modules/bookings/components/DatePicker.tsx",
          "start_line": 55,
          "end_line": 68,